{
  "manifest": {
    "traccia_version": "1.0.0",
    "package_version": "1.0.0",
    "created_at": "2026-06-08T12:05:30Z"
  },
  "session": {
    "session_id": "550e8400-e29b-41d4-a716-446655440000",
    "objective": "生成Q3财务报告",
    "started_at": "2026-06-08T12:00:00Z",
    "ended_at": "2026-06-08T12:05:30Z",
    "status": "completed"
  },
  "events": [
    {
      "event_id": "660e8400-e29b-41d4-a716-446655440001",
      "session_id": "550e8400-e29b-41d4-a716-446655440000",
      "timestamp": "2026-06-08T12:00:01Z",
      "event_type": "read_file",
      "actor_id": "agent_001",
      "payload": {
        "file_path": "/data/q3_finance.csv"
      },
      "prev_hash": null,
      "hash": "a1b2c3d4e5f6a7b8c9d0e1f2a3b4c5d6e7f8a9b0c1d2e3f4a5b6c7d8e9f0a1b2"
    },
    {
      "event_id": "660e8400-e29b-41d4-a716-446655440002",
      "session_id": "550e8400-e29b-41d4-a716-446655440000",
      "timestamp": "2026-06-08T12:00:05Z",
      "event_type": "generate_response",
      "actor_id": "agent_001",
      "payload": {
        "output_type": "report",
        "format": "pdf"
      },
      "prev_hash": "a1b2c3d4e5f6a7b8c9d0e1f2a3b4c5d6e7f8a9b0c1d2e3f4a5b6c7d8e9f0a1b2",
      "hash": "d4e5f6a7b8c9d0e1f2a3b4c5d6e7f8a9b0c1d2e3f4a5b6c7d8e9f0a1b2c3d4"
    }
  ],
  "evidence": [
    {
      "evidence_id": "770e8400-e29b-41d4-a716-446655440001",
      "event_id": "660e8400-e29b-41d4-a716-446655440001",
      "type": "file_hash",
      "sha256": "e7f8a9b0c1d2e3f4a5b6c7d8e9f0a1b2c3d4e5f6a7b8c9d0e1f2a3b4c5d6e7f8",
      "storage_uri": "file:///evidence/evd_001.bin",
      "created_at": "2026-06-08T12:00:02Z"
    }
  ],
  "attribution": {
    "attribution_id": "880e8400-e29b-41d4-a716-446655440000",
    "session_id": "550e8400-e29b-41d4-a716-446655440000",
    "executor": "agent_001",
    "supervisor": "operator_001",
    "approver": "ceo_001",
    "policy_id": "AES-RISK-001"
  },
  "signature": "MEUCIQDexample"
}